{
  "$id": "wm.story_module.v1",
  "$schema": "https://json-schema.org/draft/2020-12/schema",
  "title": "WM Story Module v1",
  "description": "Per-character authored story spine. See docs/superpowers/specs/2026-05-20-wm-vertical-slice-design.md.",
  "type": "object",
  "required": ["schema", "module_id", "character_guid", "character_name", "premise", "tone", "constraints", "beats"],
  "properties": {
    "schema": {"const": "wm.story_module.v1"},
    "module_id": {"type": "string"},
    "character_guid": {"type": "integer", "minimum": 1},
    "character_name": {"type": "string"},
    "premise": {"type": "string"},
    "tone": {"type": "string"},
    "constraints": {"type": "object"},
    "beats": {"type": "array", "minItems": 1, "items": {"$ref": "#/$defs/beat"}},
    "journal_template": {"type": ["string", "null"]}
  },
  "$defs": {
    "beat": {
      "type": "object",
      "required": ["id", "kind", "entry_condition", "outcome"],
      "properties": {
        "id": {"type": "string"},
        "kind": {"enum": ["PINNED", "OPEN"]},
        "entry_condition": {"type": "object"},
        "intent": {"type": "string"},
        "constraints": {"type": "object"},
        "payload": {"type": "object"},
        "outcome": {
          "type": "object",
          "required": ["next_beat_ref", "grant_points"],
          "properties": {
            "next_beat_ref": {"type": ["string", "null"]},
            "grant_points": {"type": "array", "items": {"$ref": "#/$defs/grant_point"}}
          }
        }
      }
    },
    "grant_point": {
      "type": "object",
      "required": ["grant_kind", "ability_ref", "when", "appropriateness"],
      "properties": {
        "grant_kind": {"const": "ability"},
        "ability_ref": {"type": "string"},
        "when": {"type": "object"},
        "appropriateness": {"type": "object"}
      }
    }
  }
}
